"","Article.Title","Link","Date.Published","News.Outlet","Preview","Key.Author","All.Authors"
"126","Ian brought 45 mph gusts, more than 2 inches of rain to Forsyth","https://journalnow.com/news/local/ian-brought-45-mph-gusts-more-than-2-inches-of-rain-to-forsyth/article_e483f8d4-4293-11ed-819b-3f600d952702.html",NA,"journalnow.com","The remnants of Hurricane Ian dumped more than 2 inches of rain and produced wind gusts as high as 45 mph in Forsyth County before moving northward out of the","John Deem",""
"127","NC most 'solar-friendly' Southeast state, study says","https://journalnow.com/news/local/nc-most-solar-friendly-southeast-state-study-says/article_8ee88cbc-384f-11ed-bdbe-bb4eba538024.html",NA,"journalnow.com","North Carolina continues to serve more of its energy sunny-side up, according to a recently released report.","John Deem",""
"128","Weaver site will never be the same: A look at the top environmental ...","https://journalnow.com/news/local/weaver-site-will-never-be-the-same-a-look-at-the-top-environmental-stories-of/article_e6416b5a-7cb5-11ed-975e-430b7b49ad4e.html",NA,"journalnow.com","As 2022 winds down, state officials await a highly anticipated report on the aftermath of a massive Winston-Salem fertilizer plant fire that became the Triad’s top environmental story of the","John Deem",""
"129","Leaves piled in Winston-Salem streets heighten flood threat","https://journalnow.com/news/local/leaves-piled-in-winston-salem-streets-heighten-flood-threat/article_368545a4-6146-11ed-b294-43d57cd5a913.html",NA,"journalnow.com","The unusually late timing of Hurricane Nicole likely will make its remnants more of a flooding threat when they move through the Triad Friday, local officials warned Thursday.","John Deem",""
"130","NC will spend millions to limit emissions when moving inmates","https://journalnow.com/news/local/nc-will-spend-millions-to-limit-emissions-when-moving-inmates/article_f9b3edf2-28aa-11ed-b0cc-1b519d3d4482.html",NA,"journalnow.com","More than half of 61 low-emission and electric transit buses approved for state funding in August will carry inmates, not commuters.","John Deem",""
"131","Snow flurries, windchills in the single digits possible on Friday","https://journalnow.com/news/local/snow-flurries-windchills-in-the-single-digits-possible-on-friday/article_853cf98e-7ff1-11ed-ae40-bf1708e3ead0.html",NA,"journalnow.com","A parka may be an appropriate item for this year’s Christmas list.","John Deem",""
"132","Manchin deal boosts prospects for pipeline through Triad","https://journalnow.com/news/local/manchin-deal-boosts-prospects-for-pipeline-through-triad/article_2916f32e-1419-11ed-a85d-efcef091b059.html",NA,"journalnow.com","Democratic congressional leaders’ apparent pledge to push for completion of the Mountain Valley Pipeline gives new life to a proposed 75-mile extension that would move 375 million cubic feet of","John Deem",""
"133","'Being a good neighbor': Airport looks to address residents' erosion ...","https://journalnow.com/news/local/being-a-good-neighbor-airport-looks-to-address-residents-erosion-issues/article_f14b9ac8-2a3c-11ed-be3f-5f6dbb056e7d.html",NA,"journalnow.com","After watching in frustration for years as a once-serene stream transformed into a turgid torrent that ate away at more of their property after nearly every downpour, help may be","John Deem",""
"134","'Lights Out': Dark buildings in Winston-Salem protect migrating birds","https://journalnow.com/news/local/lights-out-dark-buildings-in-winston-salem-protect-migrating-birds/article_9456d782-3ab9-11ed-a4c6-431b94637155.html",NA,"journalnow.com","As many of 3 million birds a day are flying over Forsyth County as another fall migration season launches.","John Deem",""
"135","Applause for pipeline pause: Centuries-old Triad farm among ...","https://journalnow.com/news/local/applause-for-pipeline-pause-centuries-old-triad-farm-among-properties-spared-from-condemnation-attempts/article_c6c12cc2-5a12-11ed-965c-bf39d6dbbbff.html",NA,"journalnow.com","Mike Herbin’s roots in the Triad reach deeper than most.","John Deem",""
"136","Down on the farm: Solar panels becoming a distinct part of rural ...","https://greensboro.com/down-on-the-farm-solar-panels-becoming-a-distinct-part-of-rural-north-carolina/article_24d1ae9a-48e3-11ed-b0a6-e3cba1af00b6.html",NA,"greensboro.com","Proposed large-scale solar facilities continue to draw opposition in North Carolina from critics who argue that swaths of panels are blights on the landscape and threaten farms in a state","John Deem",""
"137","Climate 'misperception': Periods of extreme cold expected to ...","https://journalnow.com/news/local/climate-misperception-periods-of-extreme-cold-expected-to-accompany-warmer-winters/article_418df2e0-82eb-11ed-8fea-ab70e60fbf3c.html",NA,"journalnow.com","As residents of the Triad and much of North Carolina were buffeted by Arctic gusts expected to send wind chills below zero Friday, climate change likely was far from their","John Deem",""
"138","NC clears Duke to add 1,200 megawatts of solar capacity","https://journalnow.com/news/local/nc-clears-duke-to-add-1-200-megawatts-of-solar-capacity/article_87ff1e64-5af2-11ed-868b-b35ad21cfb2d.html",NA,"journalnow.com","North Carolina regulators, poised to provide a roadmap by the end of year for Duke Energy’s efforts to meet state climate goals, have given the company some early direction.","John Deem",""
"139","'Historic repetition': Today's zoning reflects racism of past","https://journalnow.com/news/local/historic-repetition-todays-zoning-reflects-racism-of-past/article_e3bdf5ec-2aee-11ed-b8e2-3f5222647940.html",NA,"journalnow.com","Many residents living near the Winston Weaver Co. fertilizer plant likely were alarmed on the last night of Jan. 31 when emergency responders knocked on their doors and blasted loudspeaker","John Deem",""
"140","Judge's defeat puts plant fire lawsuits in 'hold pattern'","https://journalnow.com/news/local/judges-defeat-puts-plant-fire-lawsuits-in-hold-pattern/article_850177dc-7728-11ed-abef-bba4932ff0f3.html",NA,"journalnow.com","The timing of legal action against Winston Weaver Co. over last winter’s potentially explosive fertilizer plant fire is uncertain after the judge assigned to the case lost in last month’s","John Deem",""
"141","Winston-Salem council approves restrictions aimed at companies ...","https://journalnow.com/news/local/winston-salem-council-approves-restrictions-aimed-at-companies-like-winston-weaver/article_b6dc4a96-767b-11ed-8c32-db86ba3125c8.html",NA,"journalnow.com","Winston Weaver Co. has not disclosed whether it plans to replace the fertilizer plant destroyed by a days-long fire last winter.","John Deem",""
"142","Wake Forest Baptist Church on university campus 'votes to dissolve ...","https://journalnow.com/news/local/wake-forest-baptist-church-on-university-campus-votes-to-dissolve-after-66-years/article_21d2cdfc-16b4-11ed-9995-bf6735f1f93a.html",NA,"journalnow.com","Wake Forest Baptist Church, an influential voice in social justice issues and part of a nearly two-century tradition of a Baptist congregation meeting on campus, will soon close for good,","John Deem",""
"143","A look at the Triad's biggest greenhouse gas polluters, including ...","https://journalnow.com/news/local/a-look-at-the-triads-biggest-greenhouse-gas-polluters-including-ncs-worst/article_3881a7a8-71cc-11ed-9764-e70e8fb8e847.html",NA,"journalnow.com","The Triad is now home to North Carolina’s largest single source of industrial emissions that contribute to climate change. Duke Energy’s Belews Creek Steam Station, in the southeast corner of","John Deem",""
"144","Critics question Winston-Salem plan for new gas-powered police ...","https://journalnow.com/news/local/critics-question-winston-salem-plan-for-new-gas-powered-police-vehicles/article_aea61f3c-4cb4-11ed-a16d-335281f85cf1.html",NA,"journalnow.com","A handful of North Carolina law enforcement agencies have begun shifting to electric or hybrid vehicles.","John Deem",""
"145","After fertilizer plant fire, Winston-Salem eyes new restrictions ...","https://journalnow.com/news/local/after-fertilizer-plant-fire-winston-salem-eyes-new-restrictions-neighborhood-rights-activist-calls-proposal-a/article_64454748-728d-11ed-aba5-5bf9eef315cd.html",NA,"journalnow.com","Ten months after a fertilizer plant fire threatened to spark what Winston-Salem’s fire chief suggested could have been “one of the worst explosions in U.S. history,” city council members on","John Deem",""
"146","4-mile gas pipeline extension planned for Davidson County steel plant","https://journalnow.com/news/local/4-mile-gas-pipeline-extension-planned-for-davidson-county-steel-plant/article_3b75947c-7b2e-11ed-a74b-2fd5e2922972.html",NA,"journalnow.com","More than $19 million in state incentives helped Davidson County land a $350 million steel manufacturing plant expected to create 180 jobs with an average wage of nearly $100,000.","John Deem",""
"147","Pipeline project cutting through Triad has new life, assuaging some ...","https://greensboro.com/news/local/pipeline-project-cutting-through-triad-has-new-life-assuaging-some-angering-others/article_3e3c3cf8-1713-11ed-8a69-03a3b7e6018c.html",NA,"greensboro.com","Democratic congressional leaders’ apparent pledge to push for completion of the Mountain Valley Pipeline gives new life to a proposed 75-mile extension that would move 375 million cubic feet of","John Deem",""
"148","Smith Reynolds Airport eyes state funding to fix neighbors' erosion ...","https://journalnow.com/news/local/smith-reynolds-airport-eyes-state-funding-to-fix-neighbors-erosion-issues/article_e5df25f8-4425-11ed-8a77-1f7492f48d1a.html",NA,"journalnow.com","Officials from Smith Reynolds Airport have initiated efforts to address severe erosion experienced by neighboring homeowners living along Brushy Fork Creek.","John Deem",""
"149","Probe goes underground in search for contamination at site of ...","https://journalnow.com/news/local/probe-goes-underground-in-search-for-contamination-at-site-of-fertilizer-plant-fire-in-winston/article_f0f56536-2afa-11ed-bf88-cfb73e80e2f3.html",NA,"journalnow.com","Months after firefighters brought a potentially explosive blaze at the Winston Weaver fertilizer plant under control, all that remains on the site is a carefully graded mound of clay-laden soil","John Deem",""
"150","Taking charge: NC electric vehicles on the rise","https://greensboro.com/community/rockingham_now/news/taking-charge-nc-electric-vehicles-on-the-rise/article_85c6b2ec-21c7-11ed-89a0-4faf7b805034.html",NA,"greensboro.com","North Carolina drivers are gradually choosing to plug in rather than fill up.","John Deem",""
"151","Birds prefer areas with worst damage after wildfires, NC study finds","https://journalnow.com/news/local/birds-prefer-areas-with-worst-damage-after-wildfires-nc-study-finds/article_31d55874-7d92-11ed-b4ac-577f5c191f48.html",NA,"journalnow.com","While destructive and sometimes deadly, severe forest fires can ultimately be beneficial for wildlife, particularly birds, new research in North Carolina confirms.","John Deem",""
"152","Reynolds American moving away from gas-powered vehicles","https://journalnow.com/news/local/reynolds-american-moving-away-from-gas-powered-vehicles/article_67a40d1a-128f-11ed-ab56-472b1579b0cd.html",NA,"journalnow.com","Reynolds American Inc. plans to abate emissions exhaled by its company vehicles with a shift to electric and hybrid models.","John Deem",""
"153","Leaves piled in Winston-Salem streets heighten flood threat","https://greensboro.com/community/rockingham_now/news/leaves-piled-in-winston-salem-streets-heighten-flood-threat/article_ada926a6-61cc-11ed-b922-ef75bb5fe4ba.html",NA,"greensboro.com","The unusually late timing of Hurricane Nicole likely will make its remnants more of a flooding threat when they move through the Triad Friday, local officials warned Thursday.","John Deem",""
"154","Biden, Trump loom over NC's US Senate race","https://journalnow.com/news/local/biden-trump-loom-over-ncs-us-senate-race/article_15c62fe4-3604-11ed-af30-87c6a215737f.html",NA,"journalnow.com","Democrat Cheri Beasley and Republican Ted Budd face similar strategic decisions in what the latest polling shows is a tight race to replace retiring U.S. Sen. Richard Burr in North","John Deem",""
"155","Pilot reported engine trouble before deadly Winston-Salem crash","https://journalnow.com/news/local/pilot-reported-engine-trouble-before-deadly-winston-salem-crash/article_7b46adc2-692f-11ed-9f68-cf011af21f99.html",NA,"journalnow.com","The pilot of a plane involved in a deadly crash Saturday told the control tower at Smith Reynolds Airport his aircraft was experiencing engine trouble, a federal investigator said Saturday.","John Deem",""
"156","Cooper order aims to boost zero-emission trucks, buses","https://journalnow.com/news/local/cooper-order-aims-to-boost-zero-emission-trucks-buses/article_f5e9e30c-54a6-11ed-9a2e-bf82813fe875.html",NA,"journalnow.com","Gov. Roy Cooper on Tuesday issued an executive order directing the N.C. Department of Environmental Quality to set targets for future sales of zero-emission trucks and buses in the state.","John Deem",""
"157","Sun to generate half of Triad manufacturer's electricity","https://journalnow.com/news/local/sun-to-generate-half-of-triad-manufacturers-electricity/article_8e18ca50-2e17-11ed-bc0f-23c0bb38dd99.html",NA,"journalnow.com","It’s been decades since Erik Olshall and his family first embraced their native Sweden’s early shift to clean energy.","John Deem",""
"158","Nicole expected to bring heavy rain to Triad","https://journalnow.com/news/local/nicole-expected-to-bring-heavy-rain-to-triad/article_646285ac-605d-11ed-b95e-2b094060f143.html",NA,"journalnow.com","Remnants of Tropical Storm Nicole are forecast to move into the Triad Thursday night and bring heavy rain through Veterans Day, six weeks after the remains of Hurricane Ian toppled","John Deem",""
"159","Flash flood warning issued for Forsyth County until 7:30 p.m.","https://journalnow.com/news/local/flash-flood-warning-issued-for-forsyth-county-until-7-30-p-m/article_2bc45bb4-1691-11ed-9a7c-efeb9aa1fc39.html",NA,"journalnow.com","The National Weather Service has issued a flash flood warning for Forsyth County until 7:30 p.m Sunday.","John Deem",""
"160","Four WFU students victims of armed robbery","https://journalnow.com/news/local/article_bd66264a-42a3-11ed-a44d-174e279f2ad6.html",NA,"journalnow.com","Four Wake Forest University students were victims of an armed robbery Sunday, according to the school.","John Deem",""
"161","Spotted lanternfly infestation spreads from Forsyth into Guilford","https://journalnow.com/news/local/spotted-lanternfly-infestation-spreads-from-forsyth-into-guilford/article_5c70770a-2011-11ed-a6c0-1f9ae1a2fa08.html",NA,"journalnow.com","North Carolina’s first infestation of invasive spotted lanternflies has now spread outside Forsyth County.","John Deem",""
"163","Duke Energy exec named company's NC president","https://journalnow.com/news/local/duke-energy-exec-named-companys-nc-president/article_cd49a5e0-5eec-11ed-b346-6b88fc56f9e7.html",NA,"journalnow.com","The executive managing Duke Energy’s interactions with state regulators will become the utility’s North Carolina president as the Charlotte-based company awaits approval of a plan to meet mandated emissions-reduction targets.","John Deem",""
"164","Triad's first freeze possible this week, forecasters say. It could be the ...","https://journalnow.com/news/local/triads-first-freeze-possible-this-week-forecasters-say-it-could-be-the-earliest-frost-this/article_25015008-4e44-11ed-8649-8f1eea8fb30c.html",NA,"journalnow.com","Bundle up, Triad.","John Deem",""
"165","Cold snap to grip Triad into next week","https://journalnow.com/news/local/cold-snap-to-grip-triad-into-next-week/article_a201524a-66c9-11ed-8ba2-e7a70b499566.html",NA,"journalnow.com","Put another blanket on the bed.","John Deem",""
"166","Novant aims for 'net-zero' emissions by 2050","https://journalnow.com/news/local/novant-aims-for-net-zero-emissions-by-2050/article_ca39300e-33aa-11ed-a665-e37ff781c2f1.html",NA,"journalnow.com","Novant Health announced Tuesday it is accelerating efforts to shrink its carbon footprint.","John Deem",""
"167","Expanding EV access: Charlotte affordable housing residents to ...","https://journalnow.com/news/local/expanding-ev-access-charlotte-affordable-housing-residents-to-share-electric-vehicles/article_6739782a-5c8a-11ed-ace6-5be03d95f4bc.html",NA,"journalnow.com","With an average price of about $66,000, electric vehicles remain out of reach for most Americans on the lower end of the pay scale.","John Deem",""
"168","Cold Christmas in Triad would counter climate trend","https://journalnow.com/news/local/cold-christmas-in-triad-would-counter-climate-trend/article_07c08232-7d80-11ed-9513-5b3314cdf347.html",NA,"journalnow.com","A white Christmas in the Triad looks like a longshot again this year, but that doesn’t mean there won’t be a frosty feel in the air for the holidays.","John Deem",""
"169","Solar snapshot: One week of proposed NC projects","https://journalnow.com/news/local/solar-snapshot-one-week-of-proposed-nc-projects/article_2bb25acc-679a-11ed-b37d-5bad1d656861.html",NA,"journalnow.com","Mention solar energy, and images that likely come to mind for most people are endless arrays of panels sprawling over hundreds of acres or smaller rooftop collections on homes.","John Deem",""
"170","NC solar projects pump up tax revenue in rural communities","https://journalnow.com/news/local/nc-solar-projects-pump-up-tax-revenue-in-rural-communities/article_a3211c74-45bc-11ed-8eca-eb6507b695d7.html",NA,"journalnow.com","Solar means more than sustainable energy in many small NC communities. It's a financial boon to rural communities with limited sources of tax revenue.","John Deem",""
"171","NC Attorney General requests loan breaks for customers of bankrupt ...","https://journalnow.com/news/local/nc-attorney-general-requests-loan-breaks-for-customers-of-bankrupt-solar-firm/article_93a9244c-6abc-11ed-9a98-57ff2ad18733.html",NA,"journalnow.com","N.C. Attorney General Josh Stein on Tuesday asked lenders to suspend payments and interest for customers who took out loans to buy still uninstalled or incomplete solar power systems from","John Deem",""
"172","Bost, Apple win soil and water supervisor seats","https://journalnow.com/news/local/bost-apple-win-soil-and-water-supervisor-seats/article_3b08253e-5fb5-11ed-9747-5fcc07eed00a.html",NA,"journalnow.com","With two candidates running for a pair of available seats, there was no drama Tuesday in the race for Forsyth County Soil and Water Conservation District supervisor.","John Deem",""
"173","Weather-related power outages possible in Triad, Duke Energy warns","https://journalnow.com/news/local/weather-related-power-outages-possible-in-triad-duke-energy-warns/article_01ae462c-8221-11ed-b505-93fa85753b05.html",NA,"journalnow.com","High winds behind an Arctic cold front expected to move into North Carolina early Friday could lead to widespread electricity outages that possibly could extend into the Christmas weekend, Duke","John Deem",""
"174","Camp Lejeune electric 'microgrid' aimed at climate resiliency","https://journalnow.com/news/local/camp-lejeune-electric-microgrid-aimed-at-climate-resiliency/article_82290608-607e-11ed-af4e-5f8159fbd7bc.html",NA,"journalnow.com","Four years ago, Hurricane Florence attacked Marine Corps bases in North Carolina like no military enemy could.","John Deem",""
"175","NC looks to plug Triad electric vehicle charging gaps","https://journalnow.com/news/local/nc-looks-to-plug-triad-electric-vehicle-charging-gaps/article_adbc95d6-5c6f-11ed-a209-e77f1e8e7a43.html",NA,"journalnow.com","A new round of state funding means electric vehicle owners in the Triad will have more options for plugging in.","John Deem",""
"176","Republican Virginia Foxx wins 10th term in US House. She handily ...","https://journalnow.com/news/local/republican-virginia-foxx-wins-10th-term-in-us-house-she-handily-defeats-democratic-challenger/article_62385cc6-5fda-11ed-a3b0-737c00bcc029.html",NA,"journalnow.com","Republican Virginia Foxx is headed for a 10th term in Congress after breezing to a win Tuesday in the newly redrawn U.S. House 5th District.","John Deem",""
"177","'Unacceptable' or 'appropriate?' Forsyth airport's erosion solution ...","https://journalnow.com/news/local/unacceptable-or-appropriate-forsyth-airports-erosion-solution-falls-short-critics-say/article_8c84a020-4bfd-11ed-93f6-4b0756dff90f.html",NA,"journalnow.com","The man in charge of Forsyth County’s Smith Reynolds Airport insists he’s doing what he can to help neighbors who’ve dealt with a years-long problem that he only learned about","John Deem",""
"178","PNG seeks connection to planned NC biogas network","https://journalnow.com/news/local/png-seeks-connection-to-planned-nc-biogas-network/article_7b89df7c-6ab8-11ed-92ce-6b8433190dd6.html",NA,"journalnow.com","Piedmont Natural Gas on Tuesday asked state officials for permission to collect gas produced by decomposing manure stored in lagoons on at least 15 North Carolina hog farms.","John Deem",""
"179","How much could your power bill increase in coming years? There's ...","https://greensboro.com/news/local/how-much-could-your-power-bill-increase-in-coming-years-theres-a-hint-in-latest/article_f60f6d61-6d47-5c0e-8b1e-ffcccfa64371.html?mode=comments",NA,"greensboro.com","A typical Duke Energy Progress customer would pay $25 more a month by October 2025.","John Deem",""
"180","'Destructive provisions': Democrats' opposition to pipeline deal grows","https://journalnow.com/news/local/destructive-provisions-democrats-opposition-to-pipeline-deal-grows/article_2e350fb8-32e5-11ed-854a-b3da1489dfaf.html",NA,"journalnow.com","A second congressional Democrat from North Carolina is joining U.S. Rep. Kathy Manning in potentially breaking with the party’s leadership over a deal struck last month that would boost prospects","John Deem",""
"181","Proposed $90M solar project would be among NC's largest","https://journalnow.com/news/local/proposed-90m-solar-project-would-be-among-ncs-largest/article_7d49ef22-44cb-11ed-9d82-f72e7a132b1c.html",NA,"journalnow.com","A California-based solar company plans to add to its extensive North Carolina footprint with a nearly $90 million, 74 megawatt project.","John Deem",""
"183","Two Winston-Salem men shot early Sunday; one has life-threating ...","https://journalnow.com/news/local/two-winston-salem-men-shot-early-sunday-one-has-life-threating-injuries/article_84c808ac-6914-11ed-bd65-a78a4b3e04cb.html",NA,"journalnow.com","Two Winston-Salem men were shot early Sunday in the area of North Liberty Street and Fairchild Road, authorities say.","John Deem",""
"184","Temperatures plummet; homeless shelters packed in Triad","https://journalnow.com/news/local/temperatures-plummet-homeless-shelters-packed-in-triad/article_a9abaf00-82c5-11ed-96b8-7b0d13b3740d.html",NA,"journalnow.com","With temperatures diving dangerously to the single digits Friday night, people were mobilizing in Winston-Salem to help more homeless people than usual and telling people to take care of their","John Deem",""
"185","How much could your power bill increase in coming years? There's ...","https://journalnow.com/news/local/how-much-could-your-power-bill-increase-in-coming-years-theres-a-hint-in-latest/article_5a2463cc-45a9-11ed-9cf0-6741cfded061.html",NA,"journalnow.com","Duke Energy customers in Eastern North Carolina and in certain Asheville-area counties would see a 16% increase in electric bills over a three-year period under rate changes proposed by the","John Deem",""
"186","500-home Riverwalk development gets unanimous OK from Forsyth ...","https://journalnow.com/news/local/500-home-riverwalk-development-gets-unanimous-ok-from-forsyth-county-commissioners/article_ed768054-24b8-11ed-9197-bb419a3675fa.html",NA,"journalnow.com","The Forsyth County Board of Commissioners on Thursday unanimously approved a rezoning request that clears the way for construction of more than 500 homes on a 319-acre tract along the","John Deem",""
"187","Man charged with stabbing 5 after Surry birthday party turns violent","https://journalnow.com/news/local/crime-and-courts/man-charged-with-stabbing-5-after-surry-birthday-party-turns-violent/article_9e633400-42a2-11ed-bd77-dfcfaab7ed05.html",NA,"journalnow.com","Five people were stabbed early Sunday after an altercation at a Surry County birthday party, according to authorities.","John Deem",""
"188","As Forsyth mulls 500-home development near Tanglewood, experts ...","https://journalnow.com/news/local/as-forsyth-mulls-500-home-development-near-tanglewood-experts-rip-outdated-nc-flood-assumptions/article_70cc32de-225a-11ed-9d8e-5319301bc4b0.html",NA,"journalnow.com","The Forsyth County Board of Commissioners is expected to vote Thursday on a rezoning request that, if approved, could clear the way for construction of more than 500 homes on","John Deem",""
"189","Christmas Trees","https://greensboro.com/christmas-trees/article_f34ad582-21ae-11ed-b9e1-bf89254471c0.html",NA,"greensboro.com","Evergreens line the slopes of Joe Freeman’s Ashe County farm like a regiment of soldiers in tight formation.","John Deem",""
"190","Winston-Salem fertilizer plant improperly stored explosive material ...","https://greensboro.com/news/local/winston-salem-fertilizer-plant-improperly-stored-explosive-material-before-january-fire-state-says/article_fdc8215c-64db-5269-9cfd-8bdeb01d4783.html?mode=comments",NA,"greensboro.com","The agency levied fines totaling $5,600 on Winston Weaver Co. based on information gleaned during interviews with company employees after the blaze.","John Deem",""
