"","Article.Title","Link","Date.Published","News.Outlet","Preview","Key.Author","All.Authors"
"63","Yadkin drilling mystery continues; mining 'always a possibility ...","https://journalnow.com/news/local/yadkin-drilling-mystery-continues-mining-always-a-possibility-county-leader-says/article_01f75b02-7ece-11ec-98ae-83f11de6b7bc.html",NA,"journalnow.com","As more than six months of exploratory drilling comes to an end, a developer still refuses to reveal what he's looking for. An expert suggests mining could be the goal.","John Deem",""
"64","Study: Pledges by Duke, other utilities would reduce power ...","https://journalnow.com/news/local/study-pledges-by-duke-other-utilities-would-reduce-power-emissions-by-one-third/article_440aa32e-5f92-11ec-a0d5-235d3e087d1d.html",NA,"journalnow.com","Duke Energy and other large utilities would cut greenhouse gas emissions from power companies by one-third, a study released Friday found.","John Deem",""
"65","Triad under heat advisory through 8 p.m. Heat index to be as high as ...","https://journalnow.com/news/local/triad-under-heat-advisory-through-8-p-m-heat-index-to-be-as-high-as/article_333d2d02-ed93-11ec-9093-9f001df84def.html",NA,"journalnow.com","The National Weather Service has issued a heat advisory through 8 p.m. Thursday for much of the Triad, including Forsyth, Guilford, Davidson, Stanly and Anson counties.","John Deem",""
"66","Feds eye more major wind farms off NC coast","https://journalnow.com/news/local/feds-eye-more-major-wind-farms-off-nc-coast/article_f889f322-ca4f-11ec-a484-637af7cf1bbd.html",NA,"journalnow.com","At least five offshore wind-energy projects are now on the horizon for North Carolina.","John Deem",""
"67","Triad could see record heat, potentially damaging winds","https://journalnow.com/news/article_6f23db8e-9e35-11ec-afa8-0f36b97e8cea.html",NA,"journalnow.com","Temperatures around 80 degrees, wind gust of up to 50 mph and heavy rain are expected Monday in the Triad.","John Deem",""
"68","'Dangerously hot': Triad temperatures forecast to top 100","https://journalnow.com/news/local/dangerously-hot-triad-temperatures-forecast-to-top-100/article_6f66192c-eaa7-11ec-8bad-bf26cf85888a.html",NA,"journalnow.com","Nature has no need for a calendar.","John Deem",""
"69","Here comes the sun: Switch flipped on 195-acre Surry solar facility ...","https://journalnow.com/news/local/here-comes-the-sun-switch-flipped-on-195-acre-surry-solar-facility-in-surry-county/article_ec92044c-b9e2-11ec-b759-cb245e473b0c.html",NA,"journalnow.com","A 195-acre solar farm in Surry County featuring an array of 76,000 panels is up and running and will supply enough power to serve 5,000 homes, Duke Energy says.","John Deem",""
"70","Duke Energy increased wind, solar capabilities 20% in 2021","https://journalnow.com/news/local/duke-energy-increased-wind-solar-capabilities-20-in-2021/article_c2455a2c-c4dc-11ec-8f4c-0bf3e8e21612.html",NA,"journalnow.com","Charlotte-based Duke, North Carolina’s largest utility, added 1,800 megawatts of renewable energy capability in 2021, bringing its total for wind and solar to 10,500 megawatts.","John Deem",""
"71","Duke Energy increased wind, solar capabilities 20% in 2021","https://journalnow.com/news/local/duke-energy-increased-wind-solar-capabilities-20-in-2021/article_c2455a2c-c4dc-11ec-8f4c-0bf3e8e21612.html",NA,"journalnow.com","Charlotte-based Duke, North Carolina’s largest utility, added 1,800 megawatts of renewable energy capability in 2021, bringing its total for wind and solar to 10,500 megawatts.","John Deem",""
"72","Hanesbrands, Unifi and Volvo say they have jump on proposed ...","https://journalnow.com/news/local/hanesbrands-unifi-and-volvo-say-they-have-jump-on-proposed-climate-related-disclosure-rules/article_dd52efe0-b056-11ec-be08-9b29524591a1.html",NA,"journalnow.com","Triad-based manufacturers HanesBrands, Unifi and Volvo say proposed new federal disclosure rules dovetail with their own efforts to cut greenhouse gas emissions and prepare for the impacts of climate change.","John Deem",""
"73","Despite ban, outdoor fires on rise in Forsyth County","https://journalnow.com/news/local/despite-ban-outdoor-fires-on-rise-in-forsyth-county/article_71b703f6-5792-11ec-9181-3f4c0d1341ee.html",NA,"journalnow.com","Despite continuing state and local bans, firefighters in Forsyth County have seen a significant uptick in the number of reports of outdoor burning.","John Deem",""
"74","Keeping EV drivers in charge: Bill aims to get gas-guzzlers out of way","https://greensboro.com/news/local/govt-and-politics/article_1e3cdcaa-c764-5535-b3c9-1f9ad4755648.html",NA,"greensboro.com","A bill in the North Carolina General Assembly would punish drivers of gas-powered vehicles that block electric vehicles from plugging in at charging stations.","John Deem",""
"75","Snow begins falling in the Triad; up to 2 inches possible","https://journalnow.com/news/local/snow-begins-falling-in-the-triad-up-to-2-inches-possible/article_a7ea151c-8069-11ec-aa3d-937263b39029.html",NA,"journalnow.com","Snow is expected to start in the Triad Friday evening and continue overnight, with up to 3 inches possible, forecaster say.","John Deem",""
"76","Don't look up! Winston-Salem is ground zero for simulated asteroid ...","https://journalnow.com/news/local/don-t-look-up-winston-salem-is-ground-zero-for-simulated-asteroid-strike/article_79d28a24-a4ae-11ec-9c81-5b8c283f21f1.html",NA,"journalnow.com","About 160 local officials joined NASA, the U.S. Space Command and other agencies last month in a simulated scenario that put Winston-Salem in the crosshairs of a potentially destructive asteroid","John Deem",""
"77","State, Forsyth County end burn ban thanks to heavy weekend rain","https://journalnow.com/news/local/state-forsyth-county-end-burn-ban-thanks-to-heavy-weekend-rain/article_658c47fc-5c48-11ec-b3f7-73790788db1b.html",NA,"journalnow.com","Rain over the weekend prompted the N.C. Forest Service Monday to lift a two-week-old ban on outdoor burning for Forsyth and 32 other counties.","John Deem",""
"78","With battery plant, Toyota plugs into NC's surging electric vehicle ...","https://journalnow.com/with-battery-plant-toyota-plugs-into-ncs-surging-electric-vehicle-industry/article_0b7a9bce-5923-11ec-82d4-47d82e295610.html",NA,"journalnow.com","Economic development leaders and environmental activists have found common ground with Toyota's announcement that it plans a $1.3 billion facility near Greensboro to produce batteries for electric vehicles. The investment","John Deem",""
"79","More snow in the Triad? It could come Friday, forecasters say.","https://journalnow.com/news/local/more-snow-in-the-triad-it-could-come-friday-forecasters-say/article_fde1cfc8-7e2a-11ec-9bca-8bcea025b068.html",NA,"journalnow.com","The Triad could see its fourth measurable snowfall of 2022 Friday, forecasters say.","John Deem",""
"80","Forsyth County budget eases into climate-related initiatives","https://journalnow.com/news/local/forsyth-county-budget-eases-into-climate-related-initiatives/article_21320a68-de09-11ec-80f3-a74c937de18e.html",NA,"journalnow.com","Forsyth County’s proposed budget for fiscal-year 2023 reflects a modest step toward its goal of using 100% clean energy by the middle of the century.","John Deem",""
"81","Pilot Mountain fire 80% contained. Troxler urges adherence to burn ...","https://greensboro.com/news/local/article_6fbd8824-bf0d-531a-a2c5-c06d9c138630.html",NA,"greensboro.com","N.C. Agriculture Commissioner Steve Troxler said a fire on Sauratown Mountain, which burned Nov. 9-14 and reignited this week, was 100% contained.","John Deem",""
"82","Pair of new solar farms on horizon in Rockingham County","https://journalnow.com/news/local/pair-of-new-solar-farms-on-horizon-in-rockingham-county/article_80defa32-e374-11ec-aa90-9b8774a89809.html",NA,"journalnow.com","Construction is underway on a 35-acre solar farm in Rockingham County, and work is expected to start soon on a separate project covering up to 30 acres.","John Deem",""
"83","A campfire sparked the 1,000-acre Pilot Mountain blaze. Climate ...","https://journalnow.com/news/local/a-campfire-sparked-the-1-000-acre-pilot-mountain-blaze-climate-change-will-fuel-more/article_b75fe1ea-52ef-11ec-9d5f-1f1d267169c8.html",NA,"journalnow.com","A fire at Pilot Mountain State Park is under control, officials say. But experts predict warming temperatures tied to climate change will lead to more wildfires.","John Deem",""
"84","Hot and bothered: North Carolina counties wanting solar farms are ...","https://greensboro.com/bigger-fights-opposition-to-solar-farms-growing-in-nc/article_1ea528fa-c9b1-11ec-877d-f3fe8da86033.html?mode=comments",NA,"greensboro.com","In April 2021, Duke Energy and Wells Fargo announced an agreement that would allow the financial services company to buy all of the power generated at a 58-megawatt, 600-acre solar","John Deem",""
"85","Winning bids total $315M for wind-energy sites off NC coast","https://journalnow.com/news/local/winning-bids-total-315m-for-wind-energy-sites-off-nc-coast/article_dbe4344e-d17a-11ec-a1ef-bbd0e4a82309.html",NA,"journalnow.com","Duke Energy and a Texas-based subsidiary of an international energy company were the top bidders Wednesday for wind energy rights in a pair of areas totaling 110,000 acres off the","John Deem",""
"86","From the ashes: At Pilot Mountain, destruction, rebirth, glimpse of ...","https://journalnow.com/from-the-ashes-at-pilot-mountain-destruction-rebirth-glimpse-of-future/article_26af844c-547b-11ec-bb33-8700d733f357.html",NA,"journalnow.com","The Pilot Mountain fire, part of a natural cycle dating back thousands of years, also offers a sobering look at the future and the impact of climate change.","John Deem",""
"87","Water contamination a possibility near fertilizer plant fire. Runoff ...","https://journalnow.com/news/local/water-contamination-a-possibility-near-fertilizer-plant-fire-runoff-could-hit-creeks-streams-expert-says/article_6859a87e-851c-11ec-bdaa-3b65d18085b8.html",NA,"journalnow.com","Officials are investigating whether rain and firefighting efforts at the Winston Weaver Co. fertilizer plant led to contamination of nearby waterways.","John Deem",""
"88","Weekend snow, ice possible for Winston-Salem and the rest of the ...","https://journalnow.com/weekend-snow-ice-possible-for-winston-salem-and-the-rest-of-the-triad/article_cb61c47c-732b-11ec-90d4-7fbdebf48da1.html",NA,"journalnow.com","More snow and the potential for freezing rain are possible over the weekend in the Triad as a weather system blows into the region from Canada, according to forecasters.","John Deem",""
"89","Is your Earth Day T-shirt environmentally friendly?","https://journalnow.com/news/local/is-your-earth-day-t-shirt-environmentally-friendly/article_76fe83de-c1c3-11ec-841e-6fa49eb5524d.html",NA,"journalnow.com","Your Earth Day T-shirt might not be as environmentally friendly as the message printed on it.","John Deem",""
"90","HanesBrands calls early climate progress 'really nice start'","https://journalnow.com/news/local/hanesbrands-calls-early-climate-progress-really-nice-start/article_b52d4f82-c029-11ec-acf9-739a26abd54f.html",NA,"journalnow.com","Apparel giant HanesBrands' strategy to ""own our supply chain"" prepared the company for climate and sustainability goals, a company executive says.","John Deem",""
"91","Snowfall expected Friday could break Triad records","https://journalnow.com/news/local/snowfall-expected-friday-could-break-triad-records/article_3ccf35ce-7eec-11ec-92f0-772ec31094a8.html",NA,"journalnow.com","The Triad's fourth measurable snowfall is possible Friday. There has never been more in a single month.","John Deem",""
"92","Mount Airy man, 81, killed in collision with chase suspect","https://journalnow.com/news/local/article_0720497e-b92d-11ec-b9ca-9bc0c66f8aaf.html",NA,"journalnow.com","An 81-year-old Mount Airy man was killed when a suspect's vehicle collided head-on with his after an 80-mile chase through four counties.","John Deem",""
"93","Smoke from fertilizer plant fire could pose health risks for some ...","https://journalnow.com/news/local/smoke-from-fertilizer-plant-fire-could-pose-health-risks-for-some-winston-salem-residents-officials/article_2cebe070-8384-11ec-a57a-afd26ff6fa96.html",NA,"journalnow.com","Forsyth County officials and health experts on Tuesday urged residents, particularly those with respiratory conditions, to avoid smoke from the fire at a Winston-Salem fertilizer plant.","John Deem",""
"94","Cooper embraces 'environmental justice' with climate change order","https://journalnow.com/news/local/cooper-embraces-environmental-justice-with-climate-change-order/article_ffa3299e-6fff-11ec-a48e-b72e43397b6f.html",NA,"journalnow.com","An executive order signed by Gov. Roy Cooper Friday enhances state goals to reduce carbon emissions while aiming to protect vulnerable communities from the impacts of climate change.","John Deem",""
"95","Storm brings wild wind, rain, snow -- and power outages -- to ...","https://journalnow.com/news/local/storm-brings-wild-wind-rain-snow----and-power-outages---/article_f32d0d6e-6cae-11ec-85bd-9b132e92e396.html",NA,"journalnow.com","As of 11 a.m., more Duke Energy customers were without power in the Triad than in any other area of the state.","John Deem",""
"96","Triad firms have jump on proposed climate-related disclosure rules","https://greensboro.com/business/local/triad-firms-have-jump-on-proposed-climate-related-disclosure-rules/article_ebcd3ada-b20e-11ec-ba02-9bbade6f88ee.html",NA,"greensboro.com","Executives from HanesBrands Inc. in Winston-Salem, and Greensboro-based Unifi Inc. and Volvo Group North America said their companies are on a path toward achieving the level of climate-related disclosure reflected","John Deem",""
"97","Winston-Salem digs out from storm","https://journalnow.com/news/local/winston-salem-digs-out-from-storm/article_da15f49a-77e3-11ec-be9b-fb386e1cf855.html",NA,"journalnow.com","Above-freezing temperatures Monday aided crews as they worked to clear snow and ice from roads in the Winston-Salem area, but potentially treacherous conditions remain in some places.","John Deem",""
"98","Hot and bothered: North Carolina counties wanting solar farms are ...","https://greensboro.com/hot-and-bothered-north-carolina-counties-wanting-solar-farms-are-feeling-the-heat/article_1ea528fa-c9b1-11ec-877d-f3fe8da86033.html",NA,"greensboro.com","In April 2021, Duke Energy and Wells Fargo announced an agreement that would allow the financial services company to buy all of the power generated at a 58-megawatt, 600-acre solar","John Deem",""
"99","History meets sustainability: Solar in designated districts poses ...","https://journalnow.com/news/local/history-meets-sustainability-solar-in-designated-districts-poses-challenges/article_927f9766-bb50-11ec-9a52-db260bc8de4f.html",NA,"journalnow.com","Two Triad owners of historic homes had very different experiences when they decided to add rooftop solar panels. It's an example of how efforts to fight climate change and preserve","John Deem",""
"100","Truist lays out environmental investments, climate vulnerabilities","https://journalnow.com/news/local/truist-lays-out-environmental-investments-climate-vulnerabilities/article_bcb3b88a-e834-11ec-bc60-97c0af13f282.html",NA,"journalnow.com","Truist Financial Corp. issued more than $4 billion in bonds aimed at environmentally and socially focused investments in 2021, and also financed more than $856 million in renewable energy projects,","John Deem",""
"101","First-day reflections: Walking with a freshman","https://journalnow.com/news/local/first-day-reflections-walking-with-a-freshman/article_26b60d6e-1a53-11ed-92dd-bbe07563f10e.html",NA,"journalnow.com","Forty-five years ago (can it possibly be that long?) an ungainly, 14-year-old boy made the one-mile walk to his high school for the first time.","John Deem",""
"102","Weaver improperly stored explosive material, state says","https://journalnow.com/news/local/weaver-improperly-stored-explosive-material-state-says/article_5d171a38-854d-11ec-bb77-0bcb07c17338.html",NA,"journalnow.com","John Deem covers climate change and the environment in the Triad and Northwest North Carolina. His work is funded by a grant from the 1Earth Fund and the Z. Smith","John Deem",""
"103","'Such a paradox': Walmart, as a customer, says Duke's carbon plan ...","https://journalnow.com/news/local/such-a-paradox-walmart-as-a-customer-says-dukes-carbon-plan-falls-short/article_674a8cbe-6b80-11ed-acff-7bd8fa674b23.html",NA,"journalnow.com","Duke Energy’s proposal to the N.C Utilities Commission for how it will meet state-mandated reductions in greenhouse gas emissions has drawn opposition from a company often on the receiving end","John Deem",""
"104","'Species on the edge': NC Christmas tree industry faces climate ...","https://journalnow.com/news/local/species-on-the-edge-nc-christmas-tree-industry-faces-climate-challenges/article_79117964-d871-11ec-9542-af8e0ccac57f.html",NA,"journalnow.com","Evergreens line the slopes of Joe Freeman’s Ashe County farm like a regiment of soldiers in tight formation.","John Deem",""
"105","Manning: No 'shortcutting environmental safeguards' to please ...","https://journalnow.com/news/local/manning-no-shortcutting-environmental-safeguards-to-please-manchin/article_6a741a60-23da-11ed-836b-57c161f1a8f2.html",NA,"journalnow.com","Count the Triad’s Kathy Manning among congressional Democrats who insist they have no obligation to follow through on a deal struck by party leaders to win a holdout senator’s support","John Deem",""
"106","Kyle Parrish faces uphill journey to beat Trump-backed U.S. Rep ...","https://journalnow.com/news/local/kyle-parrish-faces-uphill-journey-to-beat-trump-backed-u-s-rep-virginia-foxx-in/article_d0b4aefe-391d-11ed-975f-cb7f82e5abe3.html",NA,"journalnow.com","The 2022 race for North Carolina’s redrawn U.S. House 5th District reflects the non-competitive nature of most congressional races.","John Deem",""
"107","High Point sewage plant hit with $75,000 in fines","https://journalnow.com/news/local/high-point-sewage-plant-hit-with-75-000-in-fines/article_56a8a6cc-7b1e-11ed-b810-c36b1dd11940.html",NA,"journalnow.com","The city of High Point has accumulated nearly $75,000 in state fines this year related to more than two dozen violations at one of its sewer plants.","John Deem",""
"108","Ian aftermath: Winston-Salem 'pulling every resource' to collect debris","https://journalnow.com/news/local/ian-aftermath-winston-salem-pulling-every-resource-to-collect-debris/article_b0072930-434e-11ed-81d6-af636f86fb98.html",NA,"journalnow.com","After a wet, windy weekend, the Triad awoke to sunshine Monday.","John Deem",""
"109","Greensboro joins call to 'accelerate' NC's clean-energy shift","https://journalnow.com/news/local/greensboro-joins-call-to-accelerate-ncs-clean-energy-shift/article_26bc0960-23ec-11ed-8428-23c2d170a68e.html",NA,"journalnow.com","Greensboro is one of eight North Carolina communities to sign on to a document urging the N.C. Utilities Commission to approve an energy plan that keeps the state on pace","John Deem",""
"110","'It galls me': Wake Forest Baptist's demise sparks anger toward ...","https://journalnow.com/news/local/it-galls-me-wake-forest-baptists-demise-sparks-anger-toward-university/article_5ff14026-18cd-11ed-b2ab-038e9031667b.html",NA,"journalnow.com","For 66 years, Wake Forest Baptist Church has embraced a commitment to inclusion that is reflected in its motto.","John Deem",""
"111","80,000 gallons of sewage fouls creek after contractor's mistake","https://journalnow.com/news/local/80-000-gallons-of-sewage-fouls-creek-after-contractor-s-mistake/article_d36d3656-2587-11ed-a489-7ff25a2e9b49.html",NA,"journalnow.com","A contractor’s mistake led to the discharge of nearly 80,000 gallons of raw sewage into a Winston-Salem creek, officials said Friday.","John Deem",""
"112","Report: Explosive from Weaver fire could destroy a community but ...","https://journalnow.com/news/local/report-explosive-from-weaver-fire-could-destroy-a-community-but-epa-looks-the-other-way/article_ad2062c4-3532-11ed-ac57-7bfef920338e.html",NA,"journalnow.com","While conceding that “incidents involving ammonium nitrate may be among the most severe and highest-profile accidental releases both in the United States and around the world,” the Environmental Protection Agency","John Deem",""
"113","After criticism, Winston-Salem looks to add hybrid vehicles to fleet","https://journalnow.com/news/local/after-criticism-winston-salem-looks-to-add-hybrid-vehicles-to-fleet/article_3dad32ba-6209-11ed-ba01-bff6fe4a74b5.html",NA,"journalnow.com","The city of Winston-Salem is tapping the brakes on fully gas-powered vehicles.","John Deem",""
"114","In the heat of the night: Climate change warming Triad after dark","https://journalnow.com/news/local/in-the-heat-of-the-night-climate-change-warming-triad-after-dark/article_275cfea4-2fba-11ed-b38d-8f29cd6bbdf0.html",NA,"journalnow.com","Summer days in the Triad feel pretty much like they did a century ago.","John Deem",""
"115","Taking charge: NC electric vehicles on the rise","https://journalnow.com/news/local/taking-charge-nc-electric-vehicles-on-the-rise/article_375734f6-1fd8-11ed-8f6d-438e6d32817c.html",NA,"journalnow.com","More North Carolina drivers are choosing to plug in rather than fill up.","John Deem",""
"116","Banking on sun: After delay, Truliant solar installation underway","https://journalnow.com/news/local/banking-on-sun-after-delay-truliant-solar-installation-underway/article_f7759290-7d85-11ed-8548-5f5395331dd9.html",NA,"journalnow.com","After a months-long delay tied to supply-chain challenges, installation is nearly complete on an array of 880 rooftop solar panels at Truliant Federal Credit Union’s soon-to-open Winston-Salem operations center.","John Deem",""
"117","Cary takes another swing at solar with USA Baseball project","https://journalnow.com/news/local/cary-takes-another-swing-at-solar-with-usa-baseball-project/article_4e0f58b2-7812-11ed-ad87-9f31d35c2ad3.html",NA,"journalnow.com","Renewable energy continues to catch on in Cary.","John Deem",""
"118","Triad UPS facilities part of federal hazardous waste settlement","https://journalnow.com/news/local/triad-ups-facilities-part-of-federal-hazardous-waste-settlement/article_d61f20f0-5bb3-11ed-8c41-4b28b70570b4.html",NA,"journalnow.com","A half-dozen United Parcel Service facilities in the Triad are part of a $5.3 million federal settlement over violations of hazardous waste regulations by the company known for its signature","John Deem",""
"119","Forsyth commissioners approve 'uncertain' fix for erosion problem ...","https://journalnow.com/news/local/forsyth-commissioners-approve-uncertain-fix-for-erosion-problem-near-smith-reynolds-airport-in-eastern-winston/article_b4ef2878-5643-11ed-8a37-d36014fe7750.html",NA,"journalnow.com","Despite opposition from critics who argue it’s an uncertain solution that will take too long to complete if approved, Smith Reynolds Airport will seek a state grant to cover most","John Deem",""
"120","Despite Ian, Triad's fall foliage 'looking very good'","https://journalnow.com/news/local/despite-ian-triads-fall-foliage-looking-very-good/article_28b27f78-467f-11ed-aded-c7fb88112c2f.html",NA,"journalnow.com","Leaves littered Triad streets and yards after the remnants of Hurricane Ian blew through the Triad a week ago, but experts say the region’s fall foliage likely will see little","John Deem",""
"121","Cary buys solar system to power wastewater plant","https://journalnow.com/news/local/cary-buys-solar-system-to-power-wastewater-plant/article_5a1adbd6-5bbb-11ed-82ad-3ba5c3e629de.html",NA,"journalnow.com","The town of Cary didn’t have to look far for a way to reduce the carbon footprint at a municipal wastewater treatment plant.","John Deem",""
"122","'Dangerous wind chills' to grip Triad; residents urged to stay safe","https://journalnow.com/news/local/dangerous-wind-chills-to-grip-triad-residents-urged-to-stay-safe/article_239b4b14-817b-11ed-8d12-5f560aef3175.html",NA,"journalnow.com","While Wednesday marked the official change of seasons, winter is plotting a conspicuous pre-holiday proclamation of its arrival, and Triad residents are being urged to protect people, property and pets.","John Deem",""
"123","Destination uncertain for NC offshore wind power","https://journalnow.com/news/local/destination-uncertain-for-nc-offshore-wind-power/article_f706e238-6781-11ed-be05-fb071d5e518f.html",NA,"journalnow.com","Three federal leases have been granted for large-scale ocean wind farms off the coast of North Carolina, with two more potential sites now the subject of a monthlong public comment","John Deem",""
"124","Greensboro's Volvo Trucks, Pilot to create national electric-truck ...","https://journalnow.com/news/local/greensboros-volvo-trucks-pilot-to-create-national-electric-truck-charging-network/article_21ea89ee-652c-11ed-a665-bfedfb76b02d.html",NA,"journalnow.com","The traditional truck stop is poised to plug in to the future.","John Deem",""
"125","State slams Winston-Salem for 80,000-gallon sewage spill. City ...","https://journalnow.com/news/local/state-slams-winston-salem-for-80-000-gallon-sewage-spill-city-could-be-fined-thousands/article_12ff93c2-6f70-11ed-8c35-7b741ef0e435.html",NA,"journalnow.com","North Carolina environmental officials have cited the city of Winston-Salem for a wastewater violation carrying a potential $25,000 fine in connection with two August spills totaling nearly 90,000 gallons of","John Deem",""
